{
 "$schema": "./sdk-certification.schema.json",
 "name": "hidane SDK certification matrix",
 "description": "Every client and tool hidane may be used with: the version that was run, the transport, what was exercised, a status and the recorded results behind it. Generated from results/ only. See docs/sdk-certification.md.",
 "schema_version": 1,
 "generated_by": "tools/parity/sdk_certification.py",
 "statuses": [
  {
   "key": "verified",
   "label": "Verified",
   "meaning": "Every feature the client is expected to offer was exercised by a transcript pair whose two sides are identical or differ only as the documentation explains, and the version it ran with is known."
  },
  {
   "key": "partially-verified",
   "label": "Partially verified",
   "meaning": "Some recorded results cover the client, but a feature it is expected to offer was not exercised, or the version it ran with is not known, or a difference is unexplained."
  },
  {
   "key": "not-verified",
   "label": "Not verified",
   "meaning": "No recorded result covers the client. hidane may serve its transport; nobody has compared its results yet."
  }
 ],
 "features": [
  {
   "key": "documents",
   "label": "documents and writes"
  },
  {
   "key": "queries",
   "label": "queries"
  },
  {
   "key": "aggregations",
   "label": "aggregation queries"
  },
  {
   "key": "vector-search",
   "label": "vector search"
  },
  {
   "key": "transactions",
   "label": "transactions"
  },
  {
   "key": "listeners",
   "label": "listeners"
  },
  {
   "key": "reconnect",
   "label": "going offline and resuming"
  },
  {
   "key": "security-rules",
   "label": "Security Rules as signed-in, signed-out and rules-disabled users"
  },
  {
   "key": "clear",
   "label": "clearing data"
  },
  {
   "key": "triggers",
   "label": "Firestore triggers, v1 and v2"
  },
  {
   "key": "export-import",
   "label": "export and import"
  },
  {
   "key": "launch",
   "label": "launch under firebase emulators:exec"
  }
 ],
 "totals": {
  "clients": 20,
  "verified": 18,
  "partially-verified": 0,
  "not-verified": 2
 },
 "clients": [
  {
   "id": "firebase-js-node",
   "client": "firebase-js-sdk imported in Node",
   "ecosystem": "npm",
   "package": "firebase",
   "platform": "Node.js",
   "transport": [
    "gRPC"
   ],
   "status": "verified",
   "version": "13.0.0",
   "official_emulator": [
    "v1.22.0"
   ],
   "core": [
    "documents",
    "queries",
    "aggregations",
    "transactions",
    "listeners"
   ],
   "exercised": [
    "documents",
    "queries",
    "aggregations",
    "transactions",
    "listeners",
    "reconnect"
   ],
   "not_exercised": [],
   "gaps": [],
   "last_recorded": "2026-10-14",
   "tracking": null,
   "evidence": [
    {
     "transcript": "sdk-find-nearest",
     "official": "results/sdk-find-nearest-official-v1.22.0.json",
     "official_emulator": "v1.22.0",
     "official_recorded": {
      "first_recorded": "2026-10-10",
      "last_changed": "2026-10-10"
     },
     "compared": [
      {
       "path": "results/sdk-find-nearest-hidane.json",
       "result": "identical",
       "sha256": "484fb05b01ed8e33f5ba9039f2a5b6ff4fe3f9814ca407e8b055db492ac6b520",
       "recorded": {
        "first_recorded": "2026-10-10",
        "last_changed": "2026-10-10"
       }
      }
     ],
     "result": "identical",
     "packages": [
      {
       "name": "@google-cloud/firestore",
       "version": null,
       "source": "unknown",
       "where": null
      },
      {
       "name": "firebase",
       "version": null,
       "source": "unknown",
       "where": null
      }
     ],
     "features": [
      "documents"
     ]
    },
    {
     "transcript": "sdk-listen",
     "official": "results/sdk-listen-official-v1.22.0.json",
     "official_emulator": "v1.22.0",
     "official_recorded": {
      "first_recorded": "2026-10-10",
      "last_changed": "2026-10-10"
     },
     "compared": [
      {
       "path": "results/sdk-listen-hidane.json",
       "result": "documented",
       "explained_in": "results/README.md",
       "sha256": "ff32cc472d581b734ac6229969ab8942cd587ee0e3d40084e437fe426406b354",
       "recorded": {
        "first_recorded": "2026-10-10",
        "last_changed": "2026-10-10"
       }
      }
     ],
     "result": "documented",
     "packages": [
      {
       "name": "@google-cloud/firestore",
       "version": null,
       "source": "unknown",
       "where": null
      },
      {
       "name": "firebase",
       "version": null,
       "source": "unknown",
       "where": null
      }
     ],
     "features": [
      "documents",
      "queries",
      "listeners"
     ]
    },
    {
     "transcript": "sdk-listen-resume",
     "official": "results/sdk-listen-resume-official-v1.22.0.json",
     "official_emulator": "v1.22.0",
     "official_recorded": {
      "first_recorded": "2026-10-10",
      "last_changed": "2026-10-11"
     },
     "compared": [
      {
       "path": "results/sdk-listen-resume-hidane.json",
       "result": "documented",
       "explained_in": "results/README.md",
       "sha256": "3710e5a6fff021868d90aed0a27185fc24bc64b17ab37d8f35debe9538e795fd",
       "recorded": {
        "first_recorded": "2026-10-10",
        "last_changed": "2026-10-11"
       }
      }
     ],
     "result": "documented",
     "packages": [
      {
       "name": "@google-cloud/firestore",
       "version": null,
       "source": "unknown",
       "where": null
      },
      {
       "name": "firebase",
       "version": null,
       "source": "unknown",
       "where": null
      }
     ],
     "features": [
      "listeners",
      "reconnect"
     ]
    },
    {
     "transcript": "sdk-rules-unit-testing",
     "official": "results/sdk-rules-unit-testing-official-v1.22.0.json",
     "official_emulator": "v1.22.0",
     "official_recorded": {
      "first_recorded": "2026-10-13",
      "last_changed": "2026-10-13"
     },
     "compared": [
      {
       "path": "results/sdk-rules-unit-testing-hidane.json",
       "result": "documented",
       "explained_in": "results/README.md",
       "sha256": "cc75f4e58ee8f8b7aa66f5036d58fc0bd989ddbe0c87e6b3cc7405a7783fbb00",
       "recorded": {
        "first_recorded": "2026-10-13",
        "last_changed": "2026-10-13"
       }
      }
     ],
     "result": "documented",
     "packages": [
      {
       "name": "@firebase/rules-unit-testing",
       "version": "6.0.0",
       "source": "recorded",
       "where": "results/sdk-rules-unit-testing-official-v1.22.0.json"
      },
      {
       "name": "firebase",
       "version": "13.0.0",
       "source": "recorded",
       "where": "results/sdk-rules-unit-testing-official-v1.22.0.json"
      }
     ],
     "features": [
      "documents",
      "queries",
      "transactions",
      "listeners"
     ]
    },
    {
     "transcript": "sdk-web-aggregations",
     "official": "results/sdk-web-aggregations-official-v1.22.0.json",
     "official_emulator": "v1.22.0",
     "official_recorded": {
      "first_recorded": "2026-10-14",
      "last_changed": "2026-10-14"
     },
     "compared": [
      {
       "path": "results/sdk-web-aggregations-hidane.json",
       "result": "identical",
       "sha256": "bb87d2f4bf3ce3386b59a0c742f0ab5b61a006aebb7e7ac1fa5ecad8380f15a9",
       "recorded": {
        "first_recorded": "2026-10-14",
        "last_changed": "2026-10-14"
       }
      }
     ],
     "result": "identical",
     "packages": [
      {
       "name": "firebase",
       "version": "13.0.0",
       "source": "recorded",
       "where": "results/sdk-web-aggregations-official-v1.22.0.json"
      }
     ],
     "features": [
      "aggregations"
     ]
    },
    {
     "transcript": "sdk-web-transactions",
     "official": "results/sdk-web-transactions-official-v1.22.0.json",
     "official_emulator": "v1.22.0",
     "official_recorded": {
      "first_recorded": "2026-10-10",
      "last_changed": "2026-10-10"
     },
     "compared": [
      {
       "path": "results/sdk-web-transactions-hidane.json",
       "result": "identical",
       "sha256": "9fd2087e026e7ae35e668086e7d32549d772505adce7d7f39ca70a84a92d8d68",
       "recorded": {
        "first_recorded": "2026-10-10",
        "last_changed": "2026-10-10"
       }
      }
     ],
     "result": "identical",
     "packages": [
      {
       "name": "firebase",
       "version": "13.0.0",
       "source": "stated",
       "where": "results/README.md"
      }
     ],
     "features": [
      "transactions"
     ]
    },
    {
     "transcript": "sdk-web-writes",
     "official": "results/sdk-web-writes-official-v1.22.0.json",
     "official_emulator": "v1.22.0",
     "official_recorded": {
      "first_recorded": "2026-10-10",
      "last_changed": "2026-10-10"
     },
     "compared": [
      {
       "path": "results/sdk-web-writes-hidane.json",
       "result": "identical",
       "sha256": "8505450287579f98ea11c5ef0b9125fddfe9dbfb9c4dd030fdad60506980f781",
       "recorded": {
        "first_recorded": "2026-10-10",
        "last_changed": "2026-10-10"
       }
      }
     ],
     "result": "identical",
     "packages": [
      {
       "name": "firebase",
       "version": "13.0.0",
       "source": "stated",
       "where": "results/README.md"
      }
     ],
     "features": [
      "documents"
     ]
    }
   ]
  },
  {
   "id": "firebase-js-lite",
   "client": "firebase-js-sdk Lite",
   "ecosystem": "npm",
   "package": "firebase",
   "platform": "Node.js",
   "transport": [
    "REST"
   ],
   "status": "verified",
   "version": "13.0.0",
   "official_emulator": [
    "v1.22.0"
   ],
   "core": [
    "documents",
    "queries",
    "aggregations",
    "transactions"
   ],
   "exercised": [
    "documents",
    "queries",
    "aggregations",
    "transactions"
   ],
   "not_exercised": [],
   "gaps": [],
   "last_recorded": "2026-10-10",
   "tracking": null,
   "evidence": [
    {
     "transcript": "sdk-rest",